title,author
"Written in the Stars (Written in the Stars, #1)",Alexandria Bellefleur
"Triple Cross (Alex Cross, #30)",James Patterson
"The Book Woman's Daughter (The Book Woman of Troublesome Creek, #2)",Kim Michele Richardson
"The Running Grave (Cormoran Strike, #7)",Robert Galbraith
Children of Ash and Elm: A History of the Vikings,Neil Price
A Very Stable Genius: Donald J. Trump's Testing of America,Philip Rucker
"Axiom's End (Noumena, #1)",Lindsay  Ellis
The Chosen and the Beautiful,Nghi Vo
Ten Steps to Nanette: A Memoir Situation,Hannah Gadsby
Monstrilio,Gerardo Sámano Córdova
Profiles in Ignorance: How America's Politicians Got Dumb and Dumber,Andy Borowitz
"The Relentless Moon (Lady Astronaut Universe, #3)",Mary Robinette Kowal
"The Lords of Night (Shadow Bruja, #1)",J.C. Cervantes
Starling House,Alix E. Harrow
"Victory at Prescott High (The Havoc Boys, #5)",C.M. Stunich
Kaikeyi,Vaishnavi Patel
"Arsenic and Adobo (Tita Rosie's Kitchen Mystery, #1)",Mia P. Manansala
"Emerald Blaze (Hidden Legacy, #5)",Ilona Andrews
The Age of Witches,Louisa Morgan
"The Dark Archive (The Invisible Library, #7)",Genevieve Cogman
I Hate Men,Pauline Harmange
Entitled: How Male Privilege Hurts Women,Kate Manne
Lore,Alexandra Bracken
She Drives Me Crazy,Kelly Quindlen
"Iron Heart (Crier's War, #2)",Nina Varela
In Ascension,Martin MacInnes
Bittersweet: How Sorrow and Longing Make Us Whole,Susan Cain
Absolution,Alice McDermott
Who Is Maud Dixon?,Alexandra  Andrews
The Lies I Tell,Julie   Clark
"Lore Olympus: Volume Five (Lore Olympus, #5)",Rachel  Smythe
River Sing Me Home,Eleanor Shearer
Can the Monster Speak? A Report to an Academy of Psychoanalysts,Paul B. Preciado
Miss Benson's Beetle,Rachel Joyce
Medusa,Jessie Burton
"The American Roommate Experiment (Spanish Love Deception, #2)",Elena  Armas
Rock Paper Scissors,Alice Feeney
Solito,Javier Zamora
The Wonder Boy of Whistle Stop,Fannie Flagg
Ejaculate Responsibly: A Whole New Way to Think About Abortion,Gabrielle Stanley Blair
Something Wilder,Christina Lauren
The Undertaking of Hart and Mercy,Megan Bannen
Mothered,Zoje Stage
"22 Seconds (Women’s Murder Club, #22)",James Patterson
"The Prison Healer (The Prison Healer, #1)",Lynette Noni
Big Friendship: How We Keep Each Other Close,Aminatou Sow
"Kingdom of the Wicked (Kingdom of the Wicked, #1)",Kerri Maniscalco
A History of My Brief Body,Billy-Ray Belcourt
The Survivors,Jane Harper
Heart Bones,Colleen Hoover
Trust: America's Best Chance,Pete Buttigieg
The Mermaid of Black Conch,Monique Roffey
"Made in China: A Prisoner, an SOS Letter, and the Hidden Cost of America's Cheap Goods",Amelia Pang
Peril,Bob Woodward
"School Trip (New Kid, #3)",Jerry Craft
"Three Sisters (The Tattooist of Auschwitz, #3)",Heather   Morris
Outlive: The Science and Art of Longevity,Peter Attia
In an Instant,Suzanne Redfearn
The Eagle's Claw,Jeff Shaara
The Last House on Needless Street,Catriona Ward
Soulswift,Megan Bannen
The Perfect World of Miwako Sumida,Clarissa Goenawan
"Blood & Honey (Serpent & Dove, #2)",Shelby Mahurin
"21st Birthday (Women's Murder Club, #21)",James Patterson
Easy Crafts for the Insane: A Mostly Funny Memoir of Mental Illness and Making Things,Kelly Williams Brown
"Kingdom of the Cursed (Kingdom of the Wicked, #2)",Kerri Maniscalco
These Silent Woods,Kimi Cunningham Grant
The Heartstopper Yearbook,Alice Oseman
"City Spies (City Spies, #1)",James Ponti
Upright Women Wanted,Sarah Gailey
Dragon Hoops,Gene Luen Yang
What Comes After,JoAnne  Tompkins
"Kate (Madison Kate, #4)",Tate James
"Find Me (WITSEC, #1)",Ashley N. Rostek
"Our Last Days in Barcelona (The Perez Family, #5)",Chanel Cleeton
Band of Sisters,Lauren Willig
"Unsettled: What Climate Science Tells Us, What It Doesn’t, and Why It Matters",Steven E. Koonin
One Damn Thing After Another: Memoirs of an Attorney General,William P. Barr
A Very Punchable Face,Colin Jost
"Again, Rachel (Walsh Family, #6)",Marian Keyes
All the Sinners Bleed,S.A. Cosby
The Last Voyage of the Andrea Doria: The Sinking of the World's Most Glamorous Ship,Greg King
Everything Beautiful in Its Time: Seasons of Love and Loss,Jenna Bush Hager
The Bear,Andrew Krivak
A Billion Years: My Escape From a Life in the Highest Ranks of Scientology,Mike Rinder
The 20th Victim (Women's Murder Club #20),James Patterson
Beyond Order: 12 More Rules For Life,Jordan B. Peterson
The Song of the Cell: An Exploration of Medicine and the New Human,Siddhartha Mukherjee
"Lost in the Moment and Found (Wayward Children, #8)",Seanan McGuire
The Girl in White Gloves,Kerri Maher
A Shining,Jon Fosse
Eden Mine,S.M. Hulse
"Lords of Wrath (The Royals of Forsyth University, #2)",Angel Lawson
My Killer Vacation,Tessa Bailey
"Isn't It Bromantic? (Bromance Book Club, #4)",Lyssa Kay Adams
Wandering Souls,Cecile Pin
The Paris Apartment,Lucy Foley
Personal Effects: What Recovering the Dead Teaches Me About Caring for the Living,Robert A.  Jensen
When the Stars Go Dark,Paula McLain
Girls That Never Die: Poems,Safia Elhillo
All the Quiet Places,Brian Thomas Isaac
Excuse Me While I Ugly Cry,Joya Goffney
The Book of Cold Cases,Simone St. James
I Left The House Today!,Cassandra Calin
The River of Silver,S.A. Chakraborty
The End of the Day,Bill Clegg
"Emily Wilde's Encyclopaedia of Faeries (Emily Wilde, #1)",Heather Fawcett
"Liar (Madison Kate, #2)",Tate James
Glucose Revolution: The Life-Changing Power of Balancing Your Blood Sugar,Jessie Inchauspé
A Cat Story,Ursula Murray Husted
Once Upon a Wardrobe,Patti Callahan Henry
An Immense World: How Animal Senses Reveal the Hidden Realms Around Us,Ed Yong
"Fake (Madison Kate, #3)",Tate James
The Other Black Girl,Zakiya Dalila Harris
Under The Great Elm: A Life of Luck & Wonder,Rich Flanders
Weather Girl,Rachel Lynn Solomon
The Wind Knows My Name,Isabel Allende
The True Love Experiment,Christina Lauren
The Darkness Outside Us,Eliot Schrefer
Indians on Vacation,Thomas King
Wandering in Strange Lands: A Daughter of the Great Migration Reclaims Her Roots,Morgan Jerkins
"Defy or Defend  (Delightfully Deadly, #2)",Gail Carriger
The Wake-Up Call,Beth O'Leary
We Were Dreamers: An Immigrant Superhero Origin Story,Simu Liu
"Hate (Madison Kate, #1)",Tate James
"Voices from the Pandemic: Americans Tell Their Stories of Crisis, Courage and Resilience",Eli Saslow
Hell of a Book,Jason Mott
"Bombshell (Hell's Belles, #1)",Sarah MacLean
"Sparring Partners (Jake Brigance, #4)",John Grisham
"Lucy by the Sea (Amgash, #4)",Elizabeth Strout
Every Summer After,Carley Fortune
Once Upon an Eid,S.K. Ali
"The Empire of Dreams (Fire and Thorns, #4)",Rae Carson
A Good Marriage,Kimberly McCreight
The Book of V.,Anna Solomon
Where the Line Breaks,Michael  Burrows
"Kill Order (The Guild, #3)",Tate James
New from Here,Kelly Yang
"The Night Country (The Hazel Wood, #2)",Melissa Albert
The House of Kennedy,James Patterson
"Lords of Pain (The Royals of Forsyth University, #1)",Angel Lawson
The Latinist,Mark Prins
Perhaps the Stars,Ada Palmer
"Below Zero (The STEMinist Novellas, #3)",Ali Hazelwood
Funny Farm: My Unexpected Life with 600 Rescue Animals,Laurie Zaleski
"Dead Drop (The Guild, #2)",Tate James
"Under One Roof (The STEMinist Novellas, #1)",Ali Hazelwood
"When Stars Collide (Chicago Stars, #9)",Susan Elizabeth Phillips
"Lost Hills (Eve Ronin, #1)",Lee Goldberg
The Children's Blizzard,Melanie Benjamin
"Stuck with You (The STEMinist Novellas, #2)",Ali Hazelwood
The Anomaly,Hervé Le Tellier
Furia,Yamile Saied Méndez
True Biz,Sara Nović
"Spy×Family 3 (SpyxFamily, #3)",Tatsuya Endo
Alone With You in the Ether,Olivie Blake
Under the Rainbow,Celia Laskey
"A Private Cathedral (Dave Robicheaux, #23)",James Lee Burke
Sorrow and Bliss,Meg Mason
The Best of Me,David Sedaris
"How the Penguins Saved Veronica (Veronica McCreedy, #1)",Hazel Prior
No Cure for Being Human: And Other Truths I Need to Hear,Kate Bowler
Dress Coded,Carrie Firestone
Rednecks,Taylor  Brown
"Glow (The Plated Prisoner, #4)",Raven Kennedy
Golden Girl,Elin Hilderbrand
Uncanny Valley,Anna Wiener
The Queen of Paris: A Novel of Coco Chanel,Pamela Binnings Ewen
Pride of Eden,Taylor  Brown
"A Dance with the Fae Prince (Married to Magic, #2)",Elise Kova
Watercress,Andrea Wang
Layover,Emily Henry
Dust Child,Nguyễn Phan Quế Mai
"Icebreaker (UCMH, #1)",Hannah  Grace
The Drowning Kind,Jennifer  McMahon
Find Me in Havana,Serena  Burdick
I Hope This Finds You Well: Poems,Kate Baer
Trans: When Ideology Meets Reality,Helen  Joyce
"Gild (The Plated Prisoner, #1)",Raven Kennedy
"Defy the Night (Defy the Night, #1)",Brigid Kemmerer
The Family Game,Catherine Steadman
"Lore Olympus, Vol. 1 (Lore Olympus, #1)",Rachel  Smythe
"King of Battle and Blood (Adrian x Isolde, #1)",Scarlett St.  Clair
"A Sunlit Weapon (Maisie Dobbs, #17)",Jacqueline Winspear
Kings of Anarchy (Brutal Boys of Everlake Prep #3),Caroline Peckham
"The Governess (Royal Outsiders, #1)",Wendy  Holden
Seven Perfect Things,Catherine Ryan Hyde
"A Treacherous Tale (Cambridge Bookshop, #2)",Elizabeth Penney
Sisters of the Lost Nation,Nick Medina
Meet Me at the Lake,Carley Fortune
Officer Clemmons,François S. Clemmons
"Book of Night (Book of Night, #1)",Holly Black
"That Time I Got Drunk and Saved a Demon (Mead Mishaps, #1)",Kimberly Lemming
"Gold (The Plated Prisoner, #5)",Raven Kennedy
The It Girl,Ruth Ware
All In: An Autobiography,Billie Jean King
"Smoke Bitten (Mercy Thompson, #12)",Patricia Briggs
Did Ye Hear Mammy Died? A Memoir,Séamas O'Reilly
The Last Lifeboat,Hazel Gaynor
The Soulmate Equation,Christina Lauren
Star of Persia:,Jill Eileen Smith
"Undercover Epicenter Nurse: How Fraud, Negligence, and Greed Led to Unnecessary Deaths at Elmhurst Hospital",Erin Marie Olszewski
Chronicles from the Land of the Happiest People on Earth,Wole Soyinka
"Beyond That, the Sea",Laura Spence-Ash
Clash of Steel: A Treasure Island Remix,C.B. Lee
"The Murder of Mr. Wickham (Mr. Darcy & Miss Tilney, #1)",Claudia Gray
Cartier's Hope,M.J. Rose
All the Frequent Troubles of Our Days: The True Story of the American Woman at the Heart of the German Resistance to Hitler,Rebecca Donner
"Broken Bonds (The Bonds that Tie, #1)",J.  Bree
The Daughter of Doctor Moreau,Silvia Moreno-Garcia
"The Dirty South (Charlie Parker, #18)",John Connolly
From The Foster House To The White House,Terrence Williams
"Paladin's Strength (The Saint of Steel, #2)",T. Kingfisher
"Outside, Inside",LeUyen Pham
The Vaster Wilds,Lauren Groff
The Deep: We all know the story of the Titanic . . . don't we?,Alma Katsu
The Oldest Student: How Mary Walker Learned to Read,Rita Lorraine Hubbard
"Classified: The Secret Career of Mary Golda Ross, Cherokee Aerospace Engineer",Traci Sorell
The Many Daughters of Afong Moy,Jamie Ford
"A Murderous Relation (Veronica Speedwell, #5)",Deanna Raybourn
A Most English Princess: A Novel of Queen Victoria's Daughter,Clare McHugh
Beautiful Country: A Memoir,Qian Julie Wang
Oh William!,Elizabeth Strout
After Annie,Anna Quindlen
"Pucking Around (Jacksonville Rays, #1)",Emily Rath
"Kings of Quarantine (Brutal Boys of Everlake Prep, #1)",Caroline Peckham
"Snotgirl, Vol. 3: Is This Real Life?",Bryan Lee O'Malley
Travelers Along the Way: A Robin Hood Remix,Aminah Mae Safi
The Nurse's Secret,Amanda Skenandore
"Invisible Child: Poverty, Survival & Hope in an American City",Andrea Elliott
So Many Beginnings: A Little Women Remix,Bethany C. Morrow
Figure It Out,Wayne Koestenbaum
"The Lost Boys of London (Bianca Goddard Mysteries, #5)",Mary Lawrence
After The Storm,Natalie P.  Jenkins
Before I Called You Mine,Nicole Deese
You Exist Too Much,Zaina Arafat
The Glass Magician,Caroline Stevermer
Sunbathing I Want To,Nicholas Dolinger
The Renascent World,Carryn W. Kerr
"The Duke of Diamonds (A Lady to Suit, #1)",Emily Windsor
I Am Not Your Slave: A Memoir,Tupa Tjipombo
A Traveler at the Gates of Wisdom,John Boyne
"Wraithblade (The Wraithblade Saga, #1)",S.M. Boyce
The Living Dead,George A. Romero
Unseen City,Amy Shearn
The Salon of Exiled Artists in California,Núria Añó
The Book of Moods: How I Turned My Worst Emotions Into My Best Life,Lauren   Martin
"The Ever Cruel Kingdom (The Never Tilting World, #2)",Rin Chupeco
The Portrait of a Mirror,A. Natasha Joukovsky
"Unlocked (Keeper of the Lost Cities, #8.5)",Shannon Messenger
The Castle of Tangled Magic,Sophie   Anderson
A Necessary Blessing,Sarah Head
The Briarmen,Joseph A. Chadwick
The House of Dust,Noah Broyles
Before Familiar Woods,Ian Pisarcik
"My Contrary Mary (Mary, #1)",Cynthia Hand
Bad Best Friend,Rachel Vail
Everything You Wanted,Nina Raman
"Deianira Queen of Laires Rellik (Deianira,  #1)",Lorenzo James
"The Duchess (Royal Outsiders, #2)",Wendy  Holden
Chaos and Grime: A Year in the Life of a Chinese City,Jacob Acerbi
"Flock (The Ravenhood, #1)",Kate  Stewart
Με λάθος σκιά,Φάνης Παπαγεωργίου
"Redeeming Justice: From Defendant to Defender, My Fight for Equity on Both Sides of a Broken System",Jarrett Adams
De Duistere Bank: De schokkende ontmaskering van Deutsche Bank,David Enrich
"Innate Magic (Marrowbone Spells, #1)",Shannon Fay
Live Yet Another Day,Niveditha Praveen
The Unexpected Gate: Chapter 1-“The Journey Begins”,Saravanan Shanmugam
"The Disordered Cosmos: A Journey into Dark Matter, Spacetime, and Dreams Deferred",Chanda Prescod-Weinstein
"In Search of a Prince (In Search of a Prince, #1)",Toni Shiloh
Pirate's Protector (Sentinels of Savannah #7),Lisa Kessler
"Moonflower Murders (Susan Ryeland, #2)",Anthony Horowitz
Afterlift,Chip Zdarsky
The Nine Lives of Rose Napolitano,Donna Freitas
Sunset,Jessie Cave
"The Alpha's Son (The Alpha's Son, #1)",Penny Jessup
"Stealing Infinity (Stolen Beauty, #1)",Alyson Noel
Nothing But Blackened Teeth,Cassandra Khaw
The Family Roe: An American Story,Joshua Prager
The Goddess of Nothing At All,Cat Rector
MUTTS,Olivia Pritchard
Notes on a Silencing: A Memoir,Lacy Crawford
The Old Coal Miner's Lamp,Vicky Peplow
"A Song Below Water (A Song Below Water, #1)",Bethany C. Morrow
Forty-Ninth,Boris Pronsky
Not in Search of Love,Kashish  Aggarwal
Existential Physics: A Scientist's Guide to Life's Biggest Questions,Sabine Hossenfelder
"Under a Veiled Moon (Inspector Corravan, #2)",Karen Odden
She Chose to Love,Yvette Dulo
The End of Men,Christina Sweeney-Baird
"The Obsidian Tower (Rooks and Ruin, #1)",Melissa Caruso
"Freezing Order: A True Story of Money Laundering, Murder, and Surviving Vladimir Putin's Wrath",Bill Browder
The Grey Wolf,Julie Mannino
The Backrooms,Morgan Solis
"Of Fire and Ash (The Fireborn Epic, #1)",Gillian Bronte Adams
The Engagement Party,Finley  Turner
Small Angels,Lauren Owen
Watch Over Me,Nina LaCour
All-Night Pharmacy,Ruth Madievsky
There Are Wolves Here Too,Niall Howell
Rouge,Mona Awad
"The Mechanics of Lust (Mackenzie Country, #2)",Jay Hogan
Azriel,Julie Mannino
A Whisper of Solace,Milena McKay
"All the Broken Places (The Boy in the Striped Pajamas, #2)",John Boyne
Consent: A Memoir,Vanessa Springora
A Study in Drowning,Ava Reid
The Passenger (The Passenger #1),Cormac McCarthy
"On the Line: A Story of Class, Solidarity, and Two Women's Epic Fight to Build a Union",Daisy Pitkin
The Sunlit Man,Brandon Sanderson
Gwen & Art Are Not in Love,Lex Croucher
"Storm of the Seven Sins (The Seven Sins, #3)",Emily Colin
Daughters of Sparta,Claire Heywood
The Water Walls,iLana Markarov
A Life on Our Planet: My Witness Statement and a Vision for the Future,David Attenborough
Super Host,Kate Russo
"The Myth of Normal: Trauma, Illness, and Healing in a Toxic Culture",Gabor Maté
Nightwatching,Tracy  Sierra
"The Brothers Hawthorne (The Inheritance Games, #4)",Jennifer Lynn Barnes
Arlindo,IlustraLu
Red River Road,Anna Downes
The Hurting Kind: Poems,Ada Limon
The First Paper Cut: An Anniversary to Die For,Camille Cabrera
In the Shadow Garden,Liz    Parker
We Are All So Good at Smiling,Amber McBride
As Long as the Lemon Trees Grow,Zoulfa Katouh
The Reappearance of Rachel Price,Holly  Jackson
"The Sunshine Court (All For the Game, #4)",Nora Sakavic
Great Circle,Maggie Shipstead
Body High,Jon Lindsey
"Sword Catcher (Sword Catcher, #1)",Cassandra Clare
Tenement Kid,Bobby Gillespie
Calculated (Calculated #1),Nova McBee
"Woman of Sunlight (Brides of Hope Mountain, #2)",Mary Connealy
Hope in the Mail: Reflections on Writing and Life,Wendelin Van Draanen
The River Home,Hannah Richell
A Graceful Swan for the Fearless Marquess,Fanny Finch
Cat Kid Comic Club,Dav Pilkey
"What Does It Mean to Be Chosen?: An Interactive Bible Study (The Chosen Bible Study Series, #1)",Amanda Jenkins
Sorrow,Tiffanie DeBartolo
"Exodus (The Ravenhood Duet, #2)",Kate  Stewart
The Vanishing Deep,Astrid Scholte
"The Dating Plan (Marriage Game, #2)",Sara Desai
Heaven and Hell: A History of the Afterlife,Bart D. Ehrman
Προσκόμματα και ποιμαντικές λύσεις για την κατάβαση της αγέλης στον κάμπο σε περίπτωση αντάρας,Αλέξιος Μάινας
Revolusi: Indonesië en het ontstaan van de moderne wereld,David Van Reybrouck
"Amazing Spider-Man Epic Collection, Vol. 5: The Secret of the Petrified Tablet",Stan Lee
The Civil War on Film,Peg A. Lamphier
Mrs. Witherspoon Goes to War,Mary   Davis
The Breath Between Waves,Charlotte Anne Hamilton
Elsewhere,Dean Koontz
The Valkyrie's Daughter (The Helheim Prophecy #1),Tiana Warner
What We Don't Talk About When We Talk About Fat,Aubrey Gordon
Pharaoh's Ticks,Kenneth J. Stein
Kundiman for Kin/Information Retrieval for Monsters,Ching-In Chen
Things I Have Withheld,Kei Miller
"The Visit (Black Stars, #1)",Chimamanda Ngozi Adichie
The Holiday Swap,Maggie Knox
How Moon Fuentez Fell in Love with the Universe,Raquel Vasquez Gilliland
"The Butcher and the Wren (Dr. Wren Muller, #1)",Alaina Urquhart
Maggots Screaming!,Max Booth III
Best Canadian Poetry 2021,Souvankham Thammavongsa
"The Quicksilver Court (Rooks and Ruin, #2)",Melissa Caruso
Biography of X,Catherine Lacey
The Almanack of Naval Ravikant: A Guide to Wealth and Happiness,Eric Jorgenson
Get Out of Your Head: Stopping the Spiral of Toxic Thoughts,Jennie Allen
Dark Factory,Kathe Koja
"Lor (Monstrous, #7)",Lily Mayne
Fall,West Camel
"The Headmistress (The Headmistress, #1)",Milena McKay
Cross Down (Alex Cross #31),James Patterson
"Love Redesigned (Lakefront Billionaires, #1)",Lauren Asher
The Summer of Broken Rules,K.L. Walther
Have I Told You This Already?: Stories I Don’t Want to Forget to Remember,Lauren Graham
Beyond The Story: 10-Year Record of BTS,Myeongseok Kang
Sunbelt Blues: The Failure of American Housing,Andrew Ross
The Light in Hidden Place,Sharon Cameron
"The Black Coast (The God-King Chronicles, #1)",Mike Brooks
Der Horror der frühen Chirurgie,Lindsey Fitzharris
"The Forgotten Kingdom (The Lost Queen, #2)",Signe Pike
Herc,Phoenicia Rogerson
"Aurora Burning  (Aurora Cycle, #2)",Amie Kaufman
Our Perfect Murder,Camille Cabrera
Me: Moth,Amber McBride
"Before I Let Go (Skyland, #1)",Kennedy Ryan
"A Curse for True Love (Once Upon a Broken Heart, #3)",Stephanie Garber
A Little Devil in America: Notes in Praise of Black Performance,Hanif Abdurraqib
Nur ein Wort mit sieben Buchstaben,Ava  Reed
"In the Roses of Pieria (The Blood Files, #1)",Anna  Burke
The Silver Swan: In Search of Doris Duke,Sallie Bingham
"Blood Countess (Lady Slayers, #1)",Lana Popović
"How the Lady Was Won (The Survivors, #7)",Shana Galen
Every Other Weekend,Abigail  Johnson
"The Court of Mortals (Stariel, #3)",A.J. Lancaster
How to Pronounce Knife: Stories,Souvankham Thammavongsa
Το κορίτσι με το ξύλινο φόρεμα,Βίκυ Φίλιππα
"The Finish Line (The Ravenhood, #3)",Kate  Stewart
The Lincoln Conspiracy: The Secret Plot to Kill America's 16th President⁠—and Why It Failed,Brad Meltzer
"Die Around Sundown (Inspector Henri Lefort, #1)",Mark Pryor
The Living Sea of Waking Dreams,Richard Flanagan
Mark Rutte,Petra de Koning
"Amazing Spider-Man Epic Collection, Vol. 25: Maximum Carnage",Terry Kavanagh
To Be Honest: A Memoir,Michael Leviton
Love's Fortress,Jennifer Uhlarik
"Blessed Are the Chosen: An Interactive Bible Study (The Chosen Bible Study Series, #2)",Amanda Jenkins
Of Trust & Heart,Charlotte Anne Hamilton
Every Missing Piece,Melanie Conklin
Polar Vortex,Shani Mootoo
Ace of Spades,Faridah Àbíké-Íyímídé
"Kingdom of the Feared (Kingdom of the Wicked, #3)",Kerri Maniscalco
Termination Shock,Neal Stephenson
Love from Scratch,Kaitlyn Hill
"Shadow Fallen (Dream-Hunters, #6; Hellchaser, #8; Dark-Hunter, #28)",Sherrilyn Kenyon
"The Scavenger Door (Finder Chronicles, #3)",Suzanne Palmer
"The Ivory Tomb (Rooks and Ruin, #3)",Melissa Caruso
Stranded,Sarah Goodwin
Cinema Speculation,Quentin Tarantino
A History of Touch (22) (First Poets Series),Erin Emily Ann Vance
The Pole,J.M. Coetzee
Exciting Times,Naoise Dolan
"Reckless (Chestnut Springs, #4)",Elsie Silver
Życie mimo wszystko. Rozmowy o samobójstwie,Halszka Witkowska
Monica,Daniel Clowes
Ringmaster: Vince McMahon and the Unmaking of America,Abraham Riesman
Stay Gold,Tobly McSmith
Kids Run the Show,Delphine de Vigan
Weihnachten im kleinen Inselhotel (Floras Küche #4),Jenny Colgan
The Bookbinder of Jericho,Pip Williams
Becoming Wild: How Animals Learn Who They Are,Carl Safina
The Once and Future Sex: Going Medieval on Women's Roles in Society,Eleanor Janega
Die Bäume,Percival Everett
Vespertine,Margaret  Rogerson
"Better than the Movies (Better than the Movies, #1)",Lynn Painter
Musical Tables: Poems,Billy Collins
To Break a Covenant,Alison Ames
"Magdalene Nox (The Headmistress, #2)",Milena McKay
Honeybee,Craig Silvey
"With All My Heart (Play On, #3)",Samantha Young
Nottingham: The True Story of Robyn Hood,Anna  Burke
My Mother's House,Francesca Momplaisir
"Like Flames in the Night (Cities of Refuge, #4)",Connilyn Cossette
"The Highlander's Excellent Adventure (The Survivors, #8)",Shana Galen
Black Buck,Mateo Askaripour
Αστικά δύστυχα,Δημήτρης Γκιούλος
Mother May I,Joshilyn Jackson
All the Little Hopes,Leah Weiss
"Riviera Gold (Mary Russell and Sherlock Holmes, #16)",Laurie R. King
Mijn meningen zijn feiten: de wording van Thierry Baudet,Harm Ede Botje
Unsporting: How Trans Activism and Science Denial are Destroying Sport,Linda Blade
A Curse of Roses,Diana Pinguicha
"Last of the Talons (Talon, #1)",Sophie Kim
Lurking: How a Person Became a User,Joanne  McNeil
Journey to the Cross: A 40-Day Lenten Devotional,Paul David Tripp
"The Dragons, the Giant, the Women: A Memoir",Wayétu Moore
"Love Me (WITSEC, #3)",Ashley N. Rostek
"Quando accadrà dillo alle api (Outlander, #9)",Diana Gabaldon
Hero of Two Worlds: The Marquis de Lafayette in the Age of Revolution,Mike     Duncan
The Happily Ever After: A Memoir of an Unlikely Romance Novelist,Avi Steinberg
The Philosophy of Modern Song,Bob Dylan
Dark Places,Sherrilyn Kenyon
The Girl Behind the Gates,Brenda Davies
"The Tea Dragon Tapestry (Tea Dragon, #3)",Kay O'Neill
The Cloisters,Katy Hays
Me and Banksy,Tanya Lloyd Kyi
The Eighth Wonder of the World: The True Story of André the Giant,Bertrand Hébert
The Escape Artist: The Man Who Broke Out of Auschwitz to Warn the World,Jonathan Freedland
The Running Trees,Amber McMillan
Storia di due anime,Alex Landragin
Private Moscow (Private #15),James Patterson
If Tomorrow Doesn't Come,Jen St. Jude
Wrony,Petra Dvořáková
"Goodbye, Eri",Tatsuki Fujimoto
"Whispers in the Woods (Cryptid Alliance, #1)",K.C. Carmine
The Queen of Dirt Island,Donal Ryan
Going Infinite: The Rise and Fall of a New Tycoon,Michael   Lewis
Unruly: The Ridiculous History of England's Kings and Queens,David   Mitchell
The Good Wife of Bath,Karen  Brooks
"Of Time and Turtles: Mending the World, Shell by Shattered Shell",Sy Montgomery
Hotel Laguna,Nicola  Harrison
Die geheimste Erinnerung der Menschen,Mohamed Mbougar Sarr
"Zhara (Guardians of Dawn, #1)",S. Jae-Jones
Daughter of the Deep,Rick Riordan
Nonbinary: A Memoir,Genesis P-Orridge
It Looks Like Us,Alison Ames
You're Not the Problem: The Impact of Narcissism and Emotional Abuse and How to Heal,Helen Villiers
People to Follow,Olivia Worley
First Lie Wins,Ashley Elston
Role Playing,Cathy Yardley
Thrust,Lidia Yuknavitch
Golden Heritage (Crumbling Hearts #2),Carolin Wahl
The Measure,Nikki Erlick
"Spirit Run: A 6,000-Mile Marathon Through North America's Stolen Land",Noé Álvarez
Imperfect Women,Araminta Hall
Wicked Liaison,Meara Platt
Lessons From the Least of These: The Woodson Principles,Robert L. Woodson Sr.
"The Rakess (Society of Sirens, #1)",Scarlett Peckham
Ο Δον Υπαστυνόμος,Δημήτρης Καρακίτσος
Material Girls: Why Reality Matters for Feminism,Kathleen Stock
"High Risk: Stories of Pregnancy, Birth, and the Unexpected",Chavi Eve Karkowsky
"The Captive Kingdom (Ascendance, #4)",Jennifer A. Nielsen
"The Liar's Crown (Dominions, #1)",Abigail Owen
The Love Song of Ivy K. Harlowe,Hannah Moskowitz
What Are You Going Through,Sigrid Nunez
Festival Days,Jo Ann Beard
The High House,Greengrass Jessie
The Girl and the Goddess: Stories and Poems of Divine Wisdom,Nikita Gill
How to Be Ace: A Memoir of Growing Up Asexual,Rebecca    Burgess
"The Diary Keepers: World War II in the Netherlands, as Written by the People Who Lived Through It",Nina Siegal
Omar Rising,Aisha Saeed
Map Reading: The Nobel Lecture and Other Writings,Abdulrazak Gurnah
Grasp: The Science Transforming How We Learn,Sanjay Sarma
A Fig for All the Devils,C.S. Fritz
First Person Singular: Stories,Haruki Murakami
The Mountain Is You: Transforming Self-Sabotage Into Self-Mastery,Brianna Wiest
Jessi's Secret Language: A Graphic Novel (The Baby-Sitters Club Graphic Novels #12),Ann M. Martin
"The Empire's Ruin (Ashes of the Unhewn Throne, #1)",Brian Staveley
Prequel: An American Fight Against Fascism,Rachel Maddow
Look Back,Tatsuki Fujimoto
The Care and Breeding of Princes,Arden Lake
"Murtagh (The Inheritance Cycle, #5)",Christopher Paolini
The Men,Sandra Newman
"Dash & Lily: Vorsicht, Glatteis!",Rachel Cohn
"Deep State (Hayley Chill Thriller, #1)",Chris Hauty
Above Ground,Clint   Smith
