title,author
The Invisible Life of Addie LaRue,V.E.  Schwab
"The House in the Cerulean Sea (Cerulean Chronicles, #1)",T.J. Klune
Project Hail Mary,Andy Weir
The Midnight Library,Matt Haig
I'm Glad My Mom Died,Jennette McCurdy
Piranesi,Susanna Clarke
The Vanishing Half,Brit Bennett
"Fourth Wing (The Empyrean, #1)",Rebecca Yarros
"House of Earth and Blood (Crescent City, #1)",Sarah J. Maas
"The Ballad of Songbirds and Snakes (The Hunger Games, #0)",Suzanne Collins
My Dark Vanessa,Kate Elizabeth Russell
Lessons in Chemistry,Bonnie Garmus
Beach Read,Emily Henry
"A ​Court of Silver Flames (A Court of Thorns and Roses, #4)",Sarah J. Maas
The Love Hypothesis,Ali Hazelwood
Malibu Rising,Taylor Jenkins Reid
"Tomorrow, and Tomorrow, and Tomorrow",Gabrielle Zevin
Babel,R.F. Kuang
"The Inheritance Games (The Inheritance Games, #1)",Jennifer Lynn Barnes
American Dirt,Jeanine Cummins
The Four Winds,Kristin Hannah
Mexican Gothic,Silvia Moreno-Garcia
Book Lovers,Emily Henry
The Guest List,Lucy Foley
Under the Whispering Door,T.J. Klune
"Heartstopper: Volume Three (Heartstopper, #3)",Alice Oseman
Hamnet,Maggie O'Farrell
"The Thursday Murder Club (Thursday Murder Club, #1)",Richard Osman
"A Deadly Education (The Scholomance, #1)",Naomi Novik
"House of Sky and Breath (Crescent City, #2)",Sarah J. Maas
Crying in H Mart,Michelle Zauner
Sea of Tranquility,Emily St. John Mandel
Klara and the Sun,Kazuo Ishiguro
Caste: The Origins of Our Discontents,Isabel Wilkerson
Carrie Soto Is Back,Taylor Jenkins Reid
Remarkably Bright Creatures,Shelby Van Pelt
Loveless,Alice Oseman
"One of Us Is Next (One of Us Is Lying, #2)",Karen M. McManus
"Network Effect (The Murderbot Diaries, #5)",Martha Wells
People We Meet on Vacation,Emily Henry
"From Blood and Ash (Blood and Ash, #1)",Jennifer L. Armentrout
"Heartstopper: Volume Four (Heartstopper, #4)",Alice Oseman
The Glass Hotel,Emily St. John Mandel
"Chain of Gold (The Last Hours, #1)",Cassandra Clare
Bell Hammers,Lancelot Schaubert
Shuggie Bain,Douglas   Stuart
Transcendent Kingdom,Yaa Gyasi
"Legendborn (The Legendborn Cycle, #1)",Tracy Deonn
Untamed,Glennon Doyle
"The Burning God (The Poppy War, #3)",R.F. Kuang
"The Maid (Molly the Maid, #1)",Nita Prose
"Divine Rivals (Letters of Enchantment, #1)",Rebecca   Ross
Hood Feminism: Notes from the Women That a Movement Forgot,Mikki Kendall
Writers & Lovers,Lily King
A Promised Land,Barack Obama
The Rose Code,Kate Quinn
"Cemetery Boys (Cemetery Boys, #1)",Aiden Thomas
"These Violent Delights (These Violent Delights, #1)",Chloe Gong
"Rule of Wolves (King of Scars, #2)",Leigh Bardugo
Cloud Cuckoo Land,Anthony Doerr
"The Splendid and the Vile: A Saga of Churchill, Family, and Defiance During the Blitz",Erik Larson
"Rhythm of War (The Stormlight Archive, #4)",Brandon Sanderson
Long Bright River,Liz    Moore
Firekeeper’s Daughter,Angeline Boulley
The Sun Down Motel,Simone St. James
"The Empire of Gold (The Daevabad Trilogy, #3)",S.A. Chakraborty
"The Mirror & the Light (Thomas Cromwell, #3)",Hilary Mantel
Greenlights,Matthew McConaughey
Ring Shout,P. Djèlí Clark
"The Spanish Love Deception (Spanish Love Deception, #1)",Elena  Armas
The Girl with the Louding Voice,Abi Daré
The Book of Longings,Sue Monk Kidd
"The Henna Artist (The Jaipur Trilogy, #1)",Alka Joshi
Felix Ever After,Kacen Callender
"A Kingdom of Flesh and Fire (Blood and Ash, #2)",Jennifer L. Armentrout
"A Psalm for the Wild-Built (Monk & Robot, #1)",Becky  Chambers
"Take a Hint, Dani Brown (The Brown Sisters, #2)",Talia Hibbert
Demon Copperhead,Barbara Kingsolver
The Push,Ashley Audrain
Billy Summers,Stephen King
"The City We Became (Great Cities, #1)",N.K. Jemisin
Dear Edward,Ann Napolitano
The Death of Vivek Oji,Akwaeke Emezi
One to Watch,Kate Stayman-London
The Anthropocene Reviewed,John Green
"The Guncle (The Guncle, #1)",Steven  Rowley
Migrations,Charlotte McConaghy
Home Before Dark,Riley Sager
Clap When You Land,Elizabeth Acevedo
The Night Watchman,Louise Erdrich
The Hollow Places,T. Kingfisher
Hidden Valley Road: Inside the Mind of an American Family,Robert Kolker
In a Holidaze,Christina Lauren
The Dictionary of Lost Words,Pip Williams
Oona Out of Order,Margarita Montimore
The Last Flight,Julie   Clark
"Iron Flame (The Empyrean, #2)",Rebecca Yarros
The Book of Lost Names,Kristin Harmel
The Book of Two Ways,Jodi Picoult
The Pull of the Stars,Emma Donoghue
28 Summers,Elin Hilderbrand
The Switch,Beth O'Leary
The Empress of Salt and Fortune (The Singing Hills Cycle #1),Nghi Vo
The Book of Lost Friends,Lisa Wingate
"Good Girl, Bad Blood (A Good Girl's Guide to Murder, #2)",Holly  Jackson
"Legends & Lattes (Legends & Lattes, #1)",Travis Baldree
"Act Your Age, Eve Brown (The Brown Sisters, #3)",Talia Hibbert
"The Evening and the Morning (Kingsbridge, #0)",Ken Follett
"The Winners (Beartown, #3)",Fredrik Backman
"To Sleep in a Sea of Stars (Fractalverse, #1)",Christopher Paolini
All Boys Aren’t Blue,George M. Johnson
"The Past (VanWest, #1)",Kenneth   Thomas
"Beautiful World, Where Are You",Sally Rooney
"The Atlas Six (The Atlas, #1)",Olivie Blake
The Lincoln Highway,Amor Towles
"Black Sun (Between Earth and Sky, #1)",Rebecca Roanhorse
Fairy Tale,Stephen King
The Lost Apothecary,Sarah Penner
Yellowface,R.F. Kuang
Too Much and Never Enough: How My Family Created the World’s Most Dangerous Man,Mary L. Trump
Apples Never Fall,Liane Moriarty
Solutions and Other Problems,Allie Brosh
"Harlem Shuffle (Ray Carney, #1)",Colson Whitehead
The Southern Book Club's Guide to Slaying Vampires,Grady Hendrix
"Six Crimson Cranes (Six Crimson Cranes, #1)",Elizabeth Lim
"The Present (VanWest, #2)",Kenneth   Thomas
"Iron Widow (Iron Widow, #1)",Xiran Jay Zhao
The Maidens,Alex Michaelides
The Sentence,Louise Erdrich
"Harrow the Ninth (The Locked Tomb, #2)",Tamsyn Muir
"Spoiler Alert (Spoiler Alert, #1)",Olivia Dade
The Shadows,Alex North
Happy Place,Emily Henry
Code Name Hélène,Ariel Lawhon
"The Man Who Died Twice (Thursday Murder Club, #2)",Richard Osman
The Travelers Within: Into The Unknown,Daniel Mode
Tress of the Emerald Sea,Brandon Sanderson
"One Dark Window (The Shepherd King, #1)",Rachel Gillig
"As Good As Dead (A Good Girl's Guide to Murder, #3)",Holly  Jackson
"Midnight Sun (The Twilight Saga, #5)",Stephenie Meyer
The Woman in Me,Britney Spears
Redhead by the Side of the Road,Anne Tyler
Empire of Pain: The Secret History of the Sackler Dynasty,Patrick Radden Keefe
Love on the Brain,Ali Hazelwood
"The Charm Offensive (The Charm Offensive, #1)",Alison Cochrun
"Concrete Rose (The Hate U Give, #0)",Angie Thomas
"Things We Never Got Over (Knockemout, #1)",Lucy Score
The Last Train to Key West (The Perez Family #3),Chanel Cleeton
Small Things Like These,Claire Keegan
Fangs,Sarah Andersen
Reminders of Him,Colleen Hoover
Rodham,Curtis Sittenfeld
Swimming in the Dark,Tomasz Jedrowski
"Dial A for Aunties (Aunties, #1)",Jesse Q. Sutanto
"The Stolen Heir (The Stolen Heir Duology, #1)",Holly Black
"The Space Between Worlds (The Space Between Worlds, #1)",Micaiah Johnson
"Bloodmarked (Legendborn, #2)",Tracy Deonn
Our Missing Hearts,Celeste Ng
The Personal Librarian,Marie Benedict
The Reading List,Sara Nisha Adams
"Come Tumbling Down (Wayward Children, #5)",Seanan McGuire
Grown,Tiffany D. Jackson
If It Bleeds,Stephen King
"Our Violent Ends (These Violent Delights, #2)",Chloe Gong
"The Housemaid (The Housemaid, #1)",Freida McFadden
One by One,Ruth Ware
"Empire of the Vampire (Empire of the Vampire, #1)",Jay Kristoff
"She Who Became the Sun (The Radiant Emperor, #1)",Shelley Parker-Chan
"Heartstopper: Volume Five (Heartstopper, #5)",Alice Oseman
"Neon Gods (Dark Olympus, #1)",Katee Robert
The Premonition: A Pandemic Story,Michael   Lewis
"Troubled Blood (Cormoran Strike, #5)",Robert Galbraith
"Ruthless Vows (Letters of Enchantment, #2)",Rebecca   Ross
Once There Were Wolves,Charlotte McConaghy
A Wizard’s Guide to Defensive Baking,T. Kingfisher
Betty,Tiffany   McDaniel
"Any Way the Wind Blows (Simon Snow, #3)",Rainbow Rowell
"The Ballad of Never After (Once Upon a Broken Heart, #2)",Stephanie Garber
"The Hourglass Throne (The Tarot Sequence, #3)",K.D. Edwards
Leaving Isn't the Hardest Thing,Lauren  Hough
Afterlife,Julia Alvarez
"Troy (Stephen Fry's Great Mythology, #3)",Stephen Fry
"The ​Crown of Gilded Bones (Blood and Ash, #3)",Jennifer L. Armentrout
The Witch's Heart,Genevieve Gornichec
The Only Good Indians,Stephen Graham Jones
"The Galaxy, and the Ground Within (Wayfarers, #4)",Becky  Chambers
"A Desolation Called Peace (Teixcalaan, #2)",Arkady Martine
Later,Stephen King
Still Life,Sarah Winman
The Lives of Saints,Leigh Bardugo
The Cartographers,Peng Shepherd
Blacktop Wasteland,S.A. Cosby
Matrix,Lauren Groff
Horse,Geraldine Brooks
"The Heart Principle (The Kiss Quotient, #3)",Helen Hoang
A Flicker in the Dark,Stacy Willingham
The Answer Is…: Reflections on My Life,Alex Trebek
"Finlay Donovan Is Killing It (Finlay Donovan, #1)",Elle Cosimano
"Boyfriend Material (London Calling, #1)",Alexis  Hall
The Island of Missing Trees,Elif Shafak
The Once and Future Witches,Alix E. Harrow
Finding Me,Viola Davis
The Kitchen Front,Jennifer    Ryan
House of Hollow,Krystal Sutherland
Think Again: The Power of Knowing What You Don't Know,Adam Grant
Big Lies in a Small Town,Diane Chamberlain
"The Hawthorne Legacy (The Inheritance Games, #2)",Jennifer Lynn Barnes
Vagina Problems,Lara  Parker
I Must Betray You,Ruta Sepetys
"The Final Gambit (The Inheritance Games, #3)",Jennifer Lynn Barnes
How the Word Is Passed: A Reckoning with the History of Slavery Across America,Clint   Smith
"The Chalice of the Gods (Percy Jackson and the Olympians, #6)",Rick Riordan
"It Starts with Us (It Ends with Us, #2)",Colleen Hoover
Wrong Place Wrong Time,Gillian McAllister
The First to Die at the End,Adam Silvera
If I Never Met You,Mhairi McFarlane
"The Gilded Ones (The Gilded Ones, #1)",Namina Forna
The Dead Romantics,Ashley Poston
They Went Left,Monica Hesse
"The Ink Black Heart (Cormoran Strike, #6)",Robert Galbraith
Head Over Heels,Hannah Orenstein
"The Sun and the Star: A Nico di Angelo Adventure (Camp Half-Blood Chronicles, #17)",Rick Riordan
"Detransition, Baby",Torrey Peters
"It Happened One Summer (Bellinger Sisters, #1)",Tessa Bailey
"Delilah Green Doesn't Care (Bright Falls, #1)",Ashley Herring Blake
The Only One Left,Riley Sager
The Bodyguard,Katherine Center
The Ickabog,J.K. Rowling
What You Wish For,Katherine Center
Killers of a Certain Age,Deanna Raybourn
When We Cease to Understand the World,Benjamín Labatut
The Mystery of Mrs. Christie,Marie Benedict
The Vanished Birds,Simon Jimenez
Razorblade Tears,S.A. Cosby
"Across the Green Grass Fields (Wayward Children, #6)",Seanan McGuire
Pretty Things,Janelle Brown
The Searcher,Tana French
"Amari and the Night Brothers (Supernatural Investigations, #1)",B.B. Alston
Hotel Magnifique,Emily J. Taylor
"Deathless Divide (Dread Nation, #2)",Justina Ireland
"Daughter of the Moon Goddess (The Celestial Kingdom Duology, #1)",Sue Lynn Tan
When No One Is Watching,Alyssa Cole
Notes on an Execution,Danya Kukafka
The People We Keep,Allison Larkin
A Good Neighborhood,Therese Anne Fowler
"Sigh, Gone: A Misfit's Memoir of Great Books, Punk Rock, and the Fight to Fit In",Phuc  Tran
No One Is Talking About This,Patricia Lockwood
The Plot,Jean Hanff Korelitz
The Happiest Man on Earth,Eddie Jaku
The One Hundred Years of Lenni and Margot,Marianne Cronin
Valentine,Elizabeth Wetmore
"Dolly Parton, Songteller: My Life in Lyrics",Dolly Parton
"All the Stars and Teeth (All the Stars and Teeth, #1)",Adalyn  Grace
The Echo Wife,Sarah Gailey
The Paper Palace,Miranda Cowley Heller
The Woman with the Blue Star,Pam Jenoff
"The Bullet That Missed (Thursday Murder Club, #3)",Richard Osman
"Bookshops & Bonedust (Legends & Lattes, #0)",Travis Baldree
"The Lost and Found Bookshop (Bella Vista Chronicles, #3)",Susan Wiggs
"A Dowry of Blood (A Dowry of Blood, #1)",S.T. Gibson
The Covenant of Water,Abraham   Verghese
"Yours Truly (Part of Your World, #2)",Abby Jimenez
"The Last Devil to Die (Thursday Murder Club, #4)",Richard Osman
A Burning,Megha Majumdar
Big Summer,Jennifer Weiner
The Library of Legends,Janie Chang
One Last Stop,Casey McQuiston
The Mountains Sing,Nguyễn Phan Quế Mai
"All the Devils Are Here (Chief Inspector Armand Gamache, #16)",Louise Penny
"Love, Theoretically",Ali Hazelwood
"Stamped: Racism, Antiracism, and You",Jason Reynolds
Lady Clementine,Marie Benedict
Olga Dies Dreaming,Xóchitl González
"Paladin’s Grace (The Saint of Steel, #1)",T. Kingfisher
Maame,Jessica George
Monsters Born and Made,Tanvi Berwah
My Government Means to Kill Me,Rasheed Newson
The Paris Library,Janet Skeslien Charles
"Ember Queen (Ash Princess Trilogy, #3)",Laura Sebastian
Clytemnestra,Costanza Casati
"Friends, Lovers, and the Big Terrible Thing",Matthew  Perry
The Heaven & Earth Grocery Store,James   McBride
"Hell Bent (Alex Stern, #2)",Leigh Bardugo
"Two Twisted Crowns (The Shepherd King, #2)",Rachel Gillig
"The Adventures of Amina al-Sirafi (Amina al-Sirafi, #1)",Shannon Chakraborty
"Hollowpox: The Hunt for Morrigan Crow (Nevermoor, #3)",Jessica Townsend
Sin Eater,Megan Campisi
The Final Girl Support Group,Grady Hendrix
Navigate Your Stars,Jesmyn Ward
Summer Snow: New Poems,Robert Hass
Gallant,V.E.  Schwab
The Knockout Queen,Rufi Thorpe
The Mercies,Kiran Millwood Hargrave
"Life’s Too Short (The Friend Zone, #3)",Abby Jimenez
"Practice Makes Perfect (When in Rome, #2)",Sarah       Adams
The Night Shift,Alex Finlay
"The Bomber Mafia: A Dream, a Temptation, and the Longest Night of the Second World War",Malcolm Gladwell
The Burning Girls,C.J. Tudor
"Part of Your World (Part of Your World, #1)",Abby Jimenez
Hani and Ishu’s Guide to Fake Dating,Adiba Jaigirdar
Postcolonial Love Poem,Natalie Díaz
The Writing Retreat,Julia Bartz
"The Hand on the Wall (Truly Devious, #3)",Maureen Johnson
My Evil Mother,Margaret Atwood
"Twisted Games (Twisted, #2)",Ana Huang
Her Last Flight,Beatriz Williams
"The Lost Metal (Mistborn, #7)",Brandon Sanderson
"Fugitive Telemetry (The Murderbot Diaries, #6)",Martha Wells
The Illness Lesson,Clare Beams
Deacon King Kong,James   McBride
All the Dangerous Things,Stacy Willingham
"War Lord (The Saxon Stories, #13)",Bernard Cornwell
Happy-Go-Lucky,David Sedaris
Yes No Maybe So,Becky Albertalli
The Cousins,Karen M. McManus
"Leviathan Falls (The Expanse, #9)",James S.A. Corey
Big Swiss,Jen Beagin
The Paris Hours,Alex George
Spare,Prince Harry
"Jade Legacy (The Green Bone Saga, #3)",Fonda Lee
I Want You to Know We’re Still Here: A Post-Holocaust Memoir,Esther Safran Foer
Imaginary Museums: Stories,Nicolette Polek
"The Bone Shard Daughter (The Drowning Empire, #1)",Andrea Stewart
Cleopatra and Frankenstein,Coco Mellors
"Demon in the Wood (Grishaverse, #0)",Leigh Bardugo
To Wake the Giant: A Novel of Pearl Harbor,Jeff Shaara
The Operator,Gretchen Berg
Weather,Jenny Offill
"Break Your Glass Slippers (You Are Your Own Fairy Tale, #1)",Amanda Lovelace
"A River Enchanted (Elements of Cadence, #1)",Rebecca   Ross
Remote Control,Nnedi Okorafor
Five Survive,Holly  Jackson
Chain-Gang All-Stars,Nana Kwame Adjei-Brenyah
The Sweet Taste of Muscadines,Pamela Terry
"Gleam (The Plated Prisoner, #3)",Raven Kennedy
"The Last Graduate (The Scholomance, #2)",Naomi Novik
The Lies That Bind,Emily Giffin
These Tangled Vines,Julianne MacLean
These Precious Days: Essays,Ann Patchett
All Rhodes Lead Here,Mariana Zapata
Riot Baby,Tochi Onyebuchi
LOVE OVER CAPPUCCINO,Mansi Modi
Fateful Destiny: An Epic Struggle to Change the Course of American History,Marshall Anders
Metaphysics of Sound,Nataša Pantović
Anshuman krit Saral Vastu Gyan,Anshuman Srivastav
My Dirty California,Jason Mosberg
All My Rage,Sabaa Tahir
Pickard County Atlas,Chris Harding Thornton
Bewilderment,Richard Powers
Winter’s Orbit,Everina Maxwell
The Likely Resolutions of Oliver Clock,Jane  Riley
The Colony,Audrey Magee
"Well Played (Well Met, #2)",Jen DeLuca
"A Deal with the Elf King (Married to Magic, #1)",Elise Kova
How the King of Elfhame Learned to Hate Stories,Holly Black
Conjure Women,Afia Atakora
The Second Mrs. Astor,Shana Abe
"The Stardust Thief (The Sandsea Trilogy, #1)",Chelsea Abdullah
Djinn Patrol on the Purple Line,Deepa Anappara
"Magnolia Parks (Magnolia Parks Universe, #1)",Jessa Hastings
The Seven Year Slip,Ashley Poston
The Turnout,Megan Abbott
The Nineties,Chuck Klosterman
Icebreaker,A.L. Graziadei
"A Beautifully Foolish Endeavor (The Carls, #2)",Hank Green
The Bright Side Sanctuary for Animals,Becky Mandelbaum
Sharks in the Time of Saviors,Kawai Strong Washburn
"All the Feels (Spoiler Alert, #2)",Olivia Dade
Mary Jane,Jessica Anya Blau
Hang the Moon,Jeannette Walls
"The Madness of Crowds (Chief Inspector Armand Gamache, #17)",Louise Penny
"The Tower of Nero (The Trials of Apollo, #5)",Rick Riordan
The Very Secret Society of Irregular Witches,Sangu Mandanna
"To The End (Hannaford Prep, #4)",J.  Bree
Lady Tan’s Circle of Women,Lisa See
Seven Days in June,Tia Williams
"A Stitch in Time (A Stitch in Time, #1)",Kelley Armstrong
"Once Upon a Broken Heart (Once Upon a Broken Heart, #1)",Stephanie Garber
Irreversible Damage: The Transgender Craze Seducing Our Daughters,Abigail Shrier
The Promise,Damon Galgut
"Lore Olympus: Volume Four (Lore Olympus, #4)",Rachel  Smythe
"The Summer Deal (Wildstone, #5)",Jill Shalvis
"Lords of Mercy (Royals of Forsyth University, #3)",Angel Lawson
"Dawnshard (The Stormlight Archive, #3.5)",Brandon Sanderson
The House of Doors,Tan Twan Eng
"Powerless (The Powerless Trilogy, #1)",Lauren  Roberts
"World of Wonders: In Praise of Fireflies, Whale Sharks, and Other Astonishments",Aimee Nezhukumatathil
Honey Girl,Morgan  Rogers
What My Bones Know: A Memoir of Healing from Complex Trauma,Stephanie Foo
All This Time,Mikki Daughtry
Beyond the Wand: The Magic and Mayhem of Growing Up a Wizard,Tom Felton
Little Secrets,Jennifer Hillier
How to Sell a Haunted House,Grady Hendrix
Go as a River,Shelley Read
Antiracist Baby,Ibram X. Kendi
"House of Flame and Shadow (Crescent City, #3)",Sarah J. Maas
Strange Hotel,Eimear McBride
"Almost Just Friends (Wildstone, #4)",Jill Shalvis
"Finna (LitenVerse, #1)",Nino Cipri
Twilight of Democracy: The Seductive Lure of Authoritarianism,Anne Applebaum
"Return of the Trickster (Trickster, #3)",Eden Robinson
Utopia Avenue,David Mitchell
The First Woman,Jennifer Nansubuga Makumbi
"The Cheat Sheet (The Cheat Sheet, #1)",Sarah       Adams
Atlas of the Heart: Mapping Meaningful Connection and the Language of Human Experience,Brené Brown
Have You Seen Me?,Kate White
The Bone Maker,Sarah Beth Durst
The Constant Rabbit,Jasper Fforde
"Hook, Line, and Sinker (Bellinger Sisters, #2)",Tessa Bailey
"Wild Sign (Alpha & Omega, #6)",Patricia Briggs
How to Avoid a Climate Disaster: The Solutions We Have and the Breakthroughs We Need,Bill  Gates
Don’t Burn This Book: Thinking for Yourself in an Age of Unreason,Dave  Rubin
"Four Hundred Souls: A Community History of African America, 1619-2019",Ibram X. Kendi
The Bandit Queens,Parini Shroff
"Float Plan (Beck Sisters, #1)",Trish Doller
"Dear Justyce (Dear Martin, #2)",Nic Stone
The Violin Conspiracy,Brendan Slocumb
"What Moves the Dead (Sworn Soldier, #1)",T. Kingfisher
"Why Fish Don’t Exist: A Story of Loss, Love, and the Hidden Order of Life",Lulu Miller
"Imogen, Obviously",Becky Albertalli
"Agent Sonya: Lover, Mother, Soldier, Spy",Ben Macintyre
The Lost Girls of Devon,Barbara O'Neal
"Corona, False Alarm?: Facts and Figures",Karina  Reiss
"Terciel and Elinor (The Old Kingdom, #6)",Garth Nix
Young Mungo,Douglas   Stuart
No Time Like the Future: An Optimist Considers Mortality,Michael J. Fox
"A Shadow in the Ember (Flesh and Fire, #1)",Jennifer L. Armentrout
The Other Side of Beautiful,Kim Lock
Our Wives Under the Sea,Julia Armfield
Once Upon a Time in Hollywood,Quentin Tarantino
"What Happened To You? Conversations on Trauma, Resilience, and Healing",Bruce D. Perry
When We Were Birds,Ayanna Lloyd Banwo
Hester,Laurie Lico Albanese
"Entangled Life: How Fungi Make Our Worlds, Change Our Minds & Shape Our Futures",Merlin Sheldrake
You Deserve Each Other,Sarah Hogle
The Island,Adrian McKinty
"Ace: What Asexuality Reveals About Desire, Society, and the Meaning of Sex",Angela  Chen
Take My Hand,Dolen Perkins-Valdez
She Gets the Girl,Rachael Lippincott
Wilmington's Lie: The Murderous Coup of 1898 and the Rise of White Supremacy,David Zucchino
Check & Mate,Ali Hazelwood
"The Real Anthony Fauci: Bill Gates, Big Pharma, and the Global War on Democracy and Public Health",Robert F. Kennedy Jr.
Wish You Were Here,Jodi Picoult
"The Creation of Me, Them and Us",Heather  Marsh
The Forest of Vanishing Stars,Kristin Harmel
The Fortunes of Jaded Women,Carolyn Huynh
Home Body,Rupi Kaur
"A Magic Steeped in Poison (The Book of Tea, #1)",Judy I. Lin
Mad Honey,Jodi Picoult
Just as I Am,Cicely Tyson
Em,Kim Thúy
How High We Go in the Dark,Sequoia Nagamatsu
"The Golden Enclaves (The Scholomance, #3)",Naomi Novik
Cinderella Is Dead,Kalynn  Bayron
The Last Thing He Told Me,Laura Dave
"Murder on Cold Street (Lady Sherlock, #5)",Sherry Thomas
North Woods,Daniel       Mason
Instructions for Dancing,Nicola Yoon
"A Fever in the Heartland: The Ku Klux Klan's Plot to Take Over America, and the Woman Who Stopped Them",Timothy Egan
"This Poison Heart (This Poison Heart, #1)",Kalynn  Bayron
The ABCs of Black History,Rio Cortez
"Well Matched (Well Met, #3)",Jen DeLuca
The Wife Stalker,Liv Constantine
The Familiar Dark,Amy Engel
The Dawn of Everything: A New History of Humanity,David Graeber
The Ferryman,Justin Cronin
"Glint (The Plated Prisoner, #2)",Raven Kennedy
Let Us Descend,Jesmyn Ward
Snapdragon,Kat Leyh
Breath: The New Science of a Lost Art,James Nestor
Our Woman in Moscow,Beatriz Williams
"Fevered Star (Between Earth and Sky, #2)",Rebecca Roanhorse
"Winterkeep (Graceling Realm, #4)",Kristin Cashore
Flamer,Mike Curato
"Poverty, by America",Matthew Desmond
"The Wager: A Tale of Shipwreck, Mutiny and Murder",David Grann
The Family,Naomi Krupitsky
The Girl Who Fell Beneath the Sea,Axie Oh
The Other Mrs.,Mary Kubica
Light from Uncommon Stars,Ryka Aoki
"Lore Olympus: Volume Three (Lore Olympus, #3)",Rachel  Smythe
Minor Feelings: An Asian American Reckoning,Cathy Park Hong
"System Collapse (The Murderbot Diaries, #7)",Martha Wells
The Black Cabinet: The Untold Story of African Americans and Politics During the Age of Roosevelt,Jill  Watts
Unmasked: My Life Solving America's Cold Cases,Paul Holes
Violeta,Isabel Allende
"Last Memoria (Memoria Duology, #1)",Rachel Emma Shaw
"Abandoned in Death (In Death, #54)",J.D. Robb
The Witch King (Witch King #1),H.E. Edgmon
The Civil War of Amos Abernathy,Michael Leali
The Ice Cream Man and Other Stories,Sam Pink
The Dominant Animal,Kathryn Scanlan
"The Bard's Blade (The Sorcerer's Song, #1)",Brian D. Anderson
A Girl Like Me,Angela           Johnson
"A Million Kisses in Your Lifetime (Lancaster Prep, #2)",Monica  Murphy
The Silence,Daisy Pearce
A Kind of Spark,Elle McNicoll
Every Last Fear,Alex Finlay
A Day Like This,Kelley McNeil
Shrines of Gaiety,Kate Atkinson
Followers,Megan Angelo
Safe No Longer,Gayle Curtis
Open Book,Jessica Simpson
Calling for a Blanket Dance,Oscar Hokeah
Glory,NoViolet Bulawayo
The Chaos Machine: The Inside Story of How Social Media Rewired Our Minds and Our World,Max Fisher
The River We Remember,William Kent Krueger
Buses Are a Comin': Memoir of a Freedom Rider,Charles Person
Letters to My Weird Sisters: On Autism and Feminism,Joanne Limburg
The Hotel Nantucket,Elin Hilderbrand
Godshot,Chelsea Bieker
How to Become a Planet,Nicole Melleby
A History of Wild Places,Shea Ernshaw
Yearbook,Seth Rogen
Bad Cree,Jessica Johns
Bride,Ali Hazelwood
Black Sunday,Tola Rotimi Abraham
Kent State,Deborah Wiles
The Sweeney Sisters,Lian Dolan
Upgrade,Blake Crouch
Jeg foreslår at vi våkner,Beate Grimsrud
"Magic Claims (Kate Daniels: Wilmington Years, #2; Kate Daniels, #10.6)",Ilona Andrews
The Passing Playbook,Isaac Fitzsimons
In the Lives of Puppets,T.J. Klune
"On Vanishing: Mortality, Dementia, and What It Means to Disappear",Lynn Casteel Harper
Everything Sad Is Untrue,Daniel Nayeri
Heroin chic,Maria Kjos Fonn
The Office of Historical Corrections: A Novella and Stories,Danielle  Evans
"White Cat, Black Dog: Stories",Kelly Link
Memorial Drive: A Daughter's Memoir,Natasha Trethewey
"Defiant (Skyward, #4)",Brandon Sanderson
"Exiles (Aaron Falk, #3)",Jane Harper
The Gravity of Missing Things,Marisa  Urgo
"Rosaline Palmer Takes the Cake (Winner Bakes All, #1)",Alexis  Hall
"Magic Tides (Kate Daniels: Wilmington Years, #1; Kate Daniels, #10.5)",Ilona Andrews
"Walk the Wire (Amos Decker, #6; Will Robie, #5.5)",David Baldacci
Boy Parts,Eliza  Clark
Fault Lines: The Social Justice Movement and Evangelicalism's Looming Catastrophe,Voddie T. Baucham Jr.
Run Towards the Danger: Confrontations with a Body of Memory,Sarah Polley
When Women Were Dragons,Kelly Barnhill
The 23rd Midnight (Women's Murder Club #23),James Patterson
Stone Blind,Natalie Haynes
Prosper's Demon,K.J. Parker
The Life That Mattered (Roe & Evie #1; Life #1),Jewel E. Ann
Ridgeline,Michael Punke
The Prophets,Robert Jones Jr.
"Sweep of the Heart (Innkeeper Chronicles, #5)",Ilona Andrews
XOXO,Axie Oh
The Sum of Us: What Racism Costs Everyone and How We Can Prosper Together,Heather  McGhee
"A Map Is Only One Story: Twenty Writers on Immigration, Family, and the Meaning of Home",Nicole Chung
Ariadne,Jennifer Saint
The Sandman: Act I,Dirk Maggs
"ReDawn (Skyward, #2.2)",Brandon Sanderson
Running Against the Devil: A Plot to Save America from Trump — And Democrats from Themselves,Rick    Wilson
"Sharpe's Assassin (Sharpe, #21)",Bernard Cornwell
"The Jasmine Throne (The Burning Kingdoms, #1)",Tasha Suri
"Ruby Fever (Hidden Legacy, #6)",Ilona Andrews
Broken,Jenny  Lawson
Afterlives,Abdulrazak Gurnah
One Italian Summer,Rebecca Serle
"The War of Two Queens (Blood and Ash, #4)",Jennifer L. Armentrout
Tiger Mosquitoes: A Medical Crime Thriller,Kenneth J. Stein
